{
  "$schema": "./architecture/schemas/titmas-commercial-standard-foundation-freeze-entry.schema.v0.1.json",
  "record_type": "TITMAS_COMMERCIAL_STANDARD_FOUNDATION_FREEZE_ENTRY",
  "version": "0.1.0",
  "status": "TWO_INDEPENDENT_HUMAN_ROLE_DECISIONS_REQUIRED_GATES_UNCHANGED",
  "prepared_at": "2026-07-28T16:59:03+08:00",
  "maturity": "Development",
  "primary_repository": "digital-biosphere-architecture",
  "accountability_owner_ref": "zhangbin",
  "human_decision_required": true,
  "combined_decision_created": false,
  "gate_status_changed": false,
  "foundation_state": {
    "cs_g0": "NOT_MET",
    "cs_g1": "NOT_MET",
    "cs_g2_to_cs_g7": "BLOCKED",
    "valid_problem_records": 0,
    "track_b_acquisition_authorized": false,
    "role_accepted": false,
    "formal_review_execution_authorized": false,
    "standard_ready": false
  },
  "decisions": [
    {
      "decision_id": "CS-G0-ROLE-D01",
      "decision_state": "NOT_DECIDED",
      "purpose": "BOUNDED_PROBLEM_VALIDATION_AND_PRIVACY_DATA_ACCOUNTABILITY",
      "human_owner_ref": "zhangbin",
      "review": {
        "model": "qwen3.7-max",
        "verdict": "RECOMMENDED",
        "confidence": 0.95,
        "recommended_option": "A",
        "blocker_count": 0,
        "required_correction_count": 0
      },
      "recommended_option": {
        "option_id": "A",
        "selection": "ACCEPT_OPTION_A_BOUNDED_DUAL_ROLE_ACCOUNTABILITY",
        "term_expires_at": "2026-09-30T23:59:59+08:00",
        "role_refs": {
          "problem_validation_owner_ref": "zhangbin",
          "privacy_data_steward_ref": "zhangbin"
        },
        "review_model": null,
        "review_session_count": 0
      },
      "exact_token_lines": [
        "decided_by_ref=zhangbin",
        "CS-G0-ROLE-D01=ACCEPT_OPTION_A_BOUNDED_DUAL_ROLE_ACCOUNTABILITY",
        "problem_validation_owner_ref=zhangbin",
        "privacy_data_steward_ref=zhangbin",
        "term_expires_at=2026-09-30T23:59:59+08:00",
        "track_b_acquisition_authorized=false",
        "external_outreach_authorized=false",
        "data_processing_authorized=false",
        "reviewer_assignment_authorized=false",
        "record_counting_authorized=false",
        "cs_g0_pass=false",
        "standard_ready=false",
        "commercial_offer_authorized=false",
        "release_authorized=false"
      ],
      "source_bindings": [
        {
          "path": "TITMAS-CS-G0-ROLE-ACCEPTANCE-HUMAN-DECISION-PACKET-v0.1.md",
          "sha256": "db3100a34937bd350bf0a6e2f5fb637362a8727a6293d9148cd85f5d3d9c2079"
        },
        {
          "path": "TITMAS-CS-G0-ROLE-ACCEPTANCE-DECISION-CANDIDATE-QWEN-REVIEW-v0.1.json",
          "sha256": "a6434a8b8c6981d01085f0778c78ef1962cf0930a4bc75f960fa71b463b58e08"
        },
        {
          "path": "TITMAS-CS-G0-ROLE-ACCEPTANCE-DECISION-CANDIDATE-v0.1.md",
          "sha256": "bf8bb2536b81ea9adc1ff8e2d721ccda6f0f3ce931749520770ceddd2c7a0a1d"
        }
      ]
    },
    {
      "decision_id": "CS-G1-ROLE-REVIEW-D01",
      "decision_state": "NOT_DECIDED",
      "purpose": "BOUNDED_SPECIFICATION_ACCOUNTABILITY_AND_ROLE_SCOPED_QWEN_REVIEW",
      "human_owner_ref": "zhangbin",
      "review": {
        "model": "qwen3.7-max",
        "verdict": "RECOMMENDED",
        "confidence": 0.95,
        "recommended_option": "A",
        "blocker_count": 0,
        "required_correction_count": 0
      },
      "recommended_option": {
        "option_id": "A",
        "selection": "ACCEPT_OPTION_A_BOUNDED_OWNER_ACCOUNTABILITY_AND_ROLE_SCOPED_QWEN_REVIEW",
        "term_expires_at": "2026-09-30T23:59:59+08:00",
        "role_refs": {
          "veap_specification_accountability_owner_ref": "zhangbin",
          "veap_dbos_domain_boundary_review_owner_ref": "zhangbin",
          "veap_saee_domain_boundary_review_owner_ref": "zhangbin",
          "veap_eeoap_agent_evidence_boundary_review_owner_ref": "zhangbin"
        },
        "review_model": "qwen3.7-max",
        "review_session_count": 3
      },
      "exact_token_lines": [
        "decided_by_ref=zhangbin",
        "CS-G1-ROLE-REVIEW-D01=ACCEPT_OPTION_A_BOUNDED_OWNER_ACCOUNTABILITY_AND_ROLE_SCOPED_QWEN_REVIEW",
        "veap_specification_accountability_owner_ref=zhangbin",
        "veap_dbos_domain_boundary_review_owner_ref=zhangbin",
        "veap_saee_domain_boundary_review_owner_ref=zhangbin",
        "veap_eeoap_agent_evidence_boundary_review_owner_ref=zhangbin",
        "term_expires_at=2026-09-30T23:59:59+08:00",
        "review_model=qwen3.7-max",
        "review_session_count=3",
        "specification_authority_delegated=false",
        "crosswalk_accepted=false",
        "formal_review_complete=false",
        "cs_g1_pass=false",
        "implementation_authorized=false",
        "commercial_offer_authorized=false",
        "release_authorized=false"
      ],
      "source_bindings": [
        {
          "path": "TITMAS-CS-G1-OWNER-REVIEW-ASSIGNMENT-HUMAN-DECISION-PACKET-v0.1.md",
          "sha256": "cfa3b243e899fcda57232a1f92b7f22a98dd4d17a0e7abe21f3812dbb2cf8f9b"
        },
        {
          "path": "TITMAS-CS-G1-OWNER-REVIEW-ASSIGNMENT-DECISION-CANDIDATE-QWEN-REVIEW-v0.1.json",
          "sha256": "1797e425127bc58e3479b52a1c50aa8fcc11b1795e39bfe10479f2cef76ddaa6"
        },
        {
          "path": "TITMAS-CS-G1-FORMAL-REVIEW-PLAN-QWEN-AGENT-CUSTOMER-REVIEW-v0.1.json",
          "sha256": "2745b26b848e43ada0d3871bd0c7a94dba7212c3db842711c5074330921ab3ba"
        },
        {
          "path": "architecture/titmas-cs-g1-formal-review-plan.v0.1.json",
          "sha256": "fe5afbed10233ac92424cfe662ca880b1485ff7975f652ac357f0215973ff528"
        }
      ]
    }
  ],
  "decision_independence": {
    "two_decisions_remain_independent": true,
    "same_message_submission_allowed": true,
    "separate_decision_records_required": true,
    "one_decision_cannot_imply_the_other": true
  },
  "effects": {
    "authority_changed": false,
    "ownership_changed": false,
    "crosswalk_accepted": false,
    "residual_risk_accepted": false,
    "track_b_acquisition_authorized": false,
    "external_outreach_authorized": false,
    "data_processing_authorized": false,
    "record_created": false,
    "record_counted": false,
    "formal_review_complete": false,
    "cs_g0_pass": false,
    "cs_g1_pass": false,
    "implementation_authorized": false,
    "commercial_offering_authorized": false,
    "certification_authorized": false,
    "release_authorized": false,
    "deployment_authorized": false
  },
  "next_action": "EXPLICIT_HUMAN_DECISIONS_FOR_CS_G0_ROLE_D01_AND_CS_G1_ROLE_REVIEW_D01",
  "next_action_authorized": false
}
